link,title,date,source,text
https://abcnews.go.com/US/philadelphia-police-commissioner-apologizes-handled-starbucks-arrests-black/story?id=54588552,Philadelphia police commissioner apologizes for how he handled Starbucks arrests of 2 black men,19/04/2018,https://abcnews.go.com,"Philadelphia police commissioner apologizes for how he handled Starbucks arrests of 2 black men

Philadelphia Police Commissioner Richard Ross has apologized to two black men who were arrested at a local Starbucks last week for how he handled the press surrounding the incident.

Ross said the he ""failed miserably"" at how he addressed the incident last week when he said the arresting officers ""did absolutely nothing wrong.""

""I should have said the officers acted within the scope of the law and not that they didn’t do anything wrong,"" Ross said during a press conference Thursday. ""Words are very important.""

On April 12, Rashon Nelson and Donte Robinson were arrested at a downtown Philadelphia Starbucks and accused of trespassing and disturbance after a manager called 911, telling dispatchers that two men had refused to make a purchase or leave.

Rashon Nelson and Donte Robinson appear on ""Good Morning America,"" April 19, 2018, to discuss their arrest at a Philadelphia Starbucks. ABC News

The longtime friends, both 23, had just sat down at a table for a business meeting, they told ABC News on Thursday.

Cellphone video of two Philadelphia police officers handcuffing the men and escorting them out of the store caused outrage on social media after it was viewed more than 10 million times.

In a video testimonial released Saturday, Ross also accused Nelson and Robinson of being disrespectful to the officers and said they were both given several chances to leave, but refused.

Ross admitted today that he ""played a significant role"" in making the situation worse in his initial reaction to the ""unfortunate incident.""

Philadelphia Police Commissioner Richard Ross speaks to the media during a press conference, April 19, 2018 in Philadelphia. Ross apologized to the two black men who were arrested at a city Starbucks, saying that the issue of race is not lost on him and he shouldn't be the person making things worse. David Swanson/The Philadelphia Inquirer via AP Images

Before the arrest, Ross was not aware of the Starbucks business model, in which people ""spend long hours in Starbucks and aren't necessarily expected to make a purchase,"" he said, adding that it is reasonable to believe the arresting officers didn't know that either.

While Ross said the issue of race is not lost on him, he also defended the actions of his officers, saying that the fact that they were at the scene for well over 10 minutes suggests that they were trying to resolve the situation.

At the time, the department did not have a policy for dealing with similar situations, Ross said. A guideline has since been created and will be released soon, the police commissioner said.

Philadelphia Mayor Jim Kenney also issued an apology to Nelson and Robinson, saying that arrest caused ""many Philadelphians"" to witness and relive ""the trauma of racial profiling.

""I want to apologize on behalf of the City of Philadelphia to Donte Robinson and Rashon Nelson for the experience they’ve been put through,"" Kenney said. ""I want to acknowledge their pain and the pain of so many others, and commit our City to healing it together over the coming days, weeks and months.""

Kenney also lauded the police commissioner for the ""courage"" it took to apologize for his initial response.

""Sometimes courage is as simple as a willingness to evaluate your own words and actions, and to account for them,"" Kenney said. ""... I applaud his ability to reflect on this very difficult week and to articulate his changed perspective. It’s that courage and self-reflection that makes the Commissioner such an effective leader.""

Kenney said the ""current realities of race relations and bias in 2018"" will require ""ongoing re-evaluations.""

Two men were arrested at a Starbucks in Philadelphia, April 12, 2018. Twitter

After they were put in a squad car, Nelson and Robinson were taken to the police station and later freed.

Robinson told ABC News that police never read them their Miranda rights and that they were held in custody for eight hours.

""There was no reasoning,"" he said. ""They had nothing. They just kept using ‘defiant trespassing’ as their excuse for putting us behind bars.""

The store manager who called police is no longer working there, a Starbucks spokeswoman confirmed to ABC News.

Starbucks will close 8,000 company-owned stores on May 29 to train is staff on how to avoid ""racial bias,"" Starbucks said in a statement.

ABC News' Gregory Croft, Kelly McCarthy and Morgan Winsor contributed to this report."
https://www.cnbc.com/2018/04/19/men-arrested-at-philadelphia-starbucks-not-just-a-black-people-thing.html,"One of the men arrested at a Philly Starbucks: This is not a 'black people thing, it's a people thing'",19/04/2018,https://www.cnbc.com,"The two black men who were arrested a week ago at a Philadelphia Starbucks told ABC News on Thursday they hope what happened to them does not happen to anyone else.

Rashon Nelson, alongside Donte Robinson, said on ""Good Morning America"" he wants to ""take this opportunity as a stepping stone to really stand up and show your greatness and that you are not judged by the color of your skin as our ancestors were or anyone else.""

""This is not just a black people thing, it's a people thing,"" continued Nelson. ""That's exactly what we want to see out of this, true change.""

Nelson described the events of last Thursday, which were caught on video, posted online, and went viral on the internet, stirring outrage and protests over whether this was a case of racial profiling. He said he asked to use the restroom immediately after walking into the Starbucks. But he said he was told it was for paying customers only.

Robinson said they were there for a ""real estate meeting"" and that they had been ""working on this for months."" He said he conveyed that to the Starbucks employees when they asked if Nelson and he wanted anything to drink. ""We're fine. We're just waiting for a meeting, and we'll be out really quick type thing."""
https://www.cnn.com/2018/04/19/us/starbucks-arrests-police-commissioner-apology/index.html,Philadelphia’s top cop apologizes to black men arrested at Starbucks,19/04/2018,https://www.cnn.com,"CNN —

Philadelphia Police Commissioner Richard Ross apologized Thursday to two black men who were arrested while waiting for a business meeting at Starbucks, saying he made the situation worse by initially defending his officers’ actions.

Ross’ apology came at a news conference on the same day the men – Rashon Nelson and Donte Robinson – told ABC’s “Good Morning America” they were handcuffed within minutes of arriving at the store April 12 for a business meeting.

Ross said he was not aware that Starbucks allows people to sit in stores without making a purchase.

“I can appreciate, in light of the Starbucks policy and how well known it is to many, why these two men were appalled when asked to leave and for this reason, me, I apologize to them,” Ross told reporters.

Mayor Jim Kenney also apologized to the men on Thursday, acknowledging “a difficult week for many Philadelphians witnessing and reliving the trauma of racial profiling.”

“I want to acknowledge their pain and the pain of so many others, and commit our city to healing it together over the coming days, weeks and months,” he said in a statement.

Kenney also praised Ross’ “ability to reflect on this very difficult week, and to articulate his changed perspective.”

“The current realities of race relations and bias in 2018 warrant ongoing re-evaluations by each and every one of us,” he said.

Last week, a store manager called police and said the two men were sitting in the store without placing an order. They were arrested for trespassing. The person the men were waiting for arrived as they were being arrested.

After a Twitter video emerged of the men being escorted out in handcuffs, Ross initially said the officers “did absolutely nothing wrong.”

“For starters, I should have said the officers acted within the scope of the law and not that they didn’t do anything wrong,” Ross said Thursday. “Words are very important.”

The commissioner said new policy guidelines will be unveiled soon on how officers should respond to similar calls.

Kenney said a new policy on police calls for “defiant trespass” has been drafted, with the review process to be completed in a week.

The police internal affairs division investigation is to be completed by midweek, he said. Philadelphia’s Commission on Human Relations is also investigating the incident.

Kenney said the number of pedestrian stops by police has dropped 50% from 2015 to 2017.

Nelson and Robinson told ABC they went to Starbucks for a business meeting they believed would change their lives.

Instead, they walked out in handcuffs shortly after Nelson asked to use the restroom. He was told it was only for paying customers. A white store employee called 911 minutes later.

“The issue of race in this situation is not lost on me,” said Ross, 54, who is black.

“The optics are not lost on me. It is obvious the issue of race is indicative of a larger problem in our society, and I should not at all be the person that is a party to making anything worse relative to race relations. Shame on me if in any way I have done that. … I have to do better.”

No charges were filed against the men. The video of the incident went viral and ignited protests and calls for boycotts.

“I was thinking, they can’t be here for us,” Robinson said of the police. “It didn’t really hit me what was going on, that it was real, ‘til I was being double-locked with my hands behind my back.”

On Monday, the two men met with Starbucks CEO Kevin Johnson, who apologized.

An attorney for the two men told “Good Morning America” that Starbucks has agreed to a proposal to enter into mediation with a retired federal judge.

The store employee who called 911 is no longer with the company. Starbucks has not said under what circumstances the employee left.

Starbucks plans to close its 8,000 company-owned stores in the United States for the afternoon on May 29 to teach employees about racial bias. The training will be provided to about 175,000 workers.

Ross said he does not believe race played a role in the officers’ actions, but added, “As for that manager, that’s a whole other ballgame.”"
https://www.inquirer.com/philly/news/starbucks-philadelphia-arrests-black-controversy-boycott-timeline-20180419.html,Philadelphia Starbucks case: What we've learned since the arrests,19/04/2018,https://www.inquirer.com,"Protesters gathered outside the Starbucks on 18th & Spruce Streets. Two black men were arrested in a video incident that went viral. Read more

It has been a month since the arrest of two black men at a Philadelphia Starbucks spun the Seattle-based coffee chain into a whirlwind of controversy and sparked a national discussion about racial bias.

A lot has happened since then — customers have called for boycotts, protests ensued, apologies and criticisms poured in, and racial bias training is scheduled for Starbucks employees later this month.

Advertisement

It all started with a short video shared on Twitter of the pair — Rashon Nelson and Donte Robinson, both 23 — being taken out of the store at 18th and Spruce Streets in handcuffs after the manager called police. They had been asked to leave because they hadn't bought anything, and refused.

Here's a rundown of events since April 12.

Friday, May 11

Starbucks' bathrooms will be open to everyone, executive chairman Howard Schultz said during the Atlantic Council, a think tank in Washington. ""In terms of the bathroom, we're going to have to make sure that – we don't want to become a public bathroom, but we're going to make the right decision 100 percent of the time and give people the key, because we don't want anyone at Starbucks to feel as if we are not giving access to you to the bathroom because you are less than,"" he said according to a transcript of the conversation on the Atlantic Council's website. ""We want you to be more than.""

Thursday, May 3

Rashon Nelson and Donte Robinson appeared on Good Morning America for the second time since the video of their arrest went viral. The both wish to focus on the positivity that has come out of the incident, including the program they plan to start for young entrepreneurs. ""Looking at how we took a negative and turned it into a positive, that's really all we want,"" Robinson told anchor Robin Roberts. ""Not to focus on the negative, but just to focus on positive outcome.""

Wednesday, May 2

Rashon Nelson and Donte Robinson have reached separate agreements with the city and Starbucks following the mid-April incident. The city has agreed to pay them $1 each and set up a $200,000 program for young entrepreneurs at their request. They also reached an agreement with the Seattle-based coffee chain that ""will include a financial settlement as well as continued listening and dialogue between the parties,"" Starbucks announced in a statement.

Sunday, April 22

Another protest was held outside of the Starbucks at 18th and Spruce Streets, this time including more than 100 members of Omega Psi Psi ' the fraternity Rashon Nelson belonged to while attending Bloomsberg University — from across the nation. ""My skin color is not a crime,"" Terrance Jenkins, president of the graduate chapter of Omega Psi Phi, which advises the undergraduate chapter at Bloomsburg, said during the event.

Thursday, April 19

Police Commissioner Richard Ross said he made the situation surrounding the arrests worse, by saying his officers did nothing wrong. He said he would have used different words had he known Starbucks allowed people to stay in its cafes for hours without making a purchase. The officers also did not know that, he said, but asserted that they acted within the scope of the law and were respectful to the two men. ""They were put in an untenable position,"" said Ross, who apologized to the men and announced the department had drawn up new guidelines on handling future calls. He did not identify the officers. Still angered by Ross' initial response to the arrests, dozens of people on protested outside police headquarters and marched to City Hall, chanting, ""Police Department, you can't hide, we can see your dirty side."" One protester said Ross ""showed his true colors"" when he defended the officers. The two men spoke publicly, taking their stories nationally by giving interviews to both the Associated Press and ABC's Good Morning America. Rashon Nelson and Donte Robinson, friends since elementary school, are hoping it won't happen again. Robinson noted that he's not sure why he was arrested. Nelson said he looks at the incident as a ""stepping stone"" for change. ""I want to make sure that … this situation doesn't happen again,"" Robinson said on GMA. ""So what I want is for a young man or young men to not be traumatized by this and instead motivated, inspired.""

Wednesday, April 18

Executive Chairman Howard Schultz appeared on CBS This Morning, saying he was both ""ashamed"" and ""embarrassed."" POWER, an interfaith group, announced a rally and march for police accountability to be held Thursday, partially in response to Police Commissioner Richard Ross' comments that the arresting officers acted properly. Inquirer and Daily News reporters spoke to Rashon Nelson's neighbors in Southwest Philly. Those who know Nelson portrayed the former Bloomsburg University fraternity brother and father in favorable light. ""Rashon is a good kid, he's a good father, and he's not a thug,"" said John Gossett, 48.

Tuesday, April 17

Starbucks announced it would close all of its U.S. stores for the afternoon of May 29 while its employees undergo ""racial-bias education."" ""Closing our stores for racial-bias training is just one step in a journey that requires dedication from every level of our company and partnerships in our local communities,"" Starbucks chief executive Kevin Johnson said in a statement. The Philadelphia Police Department released recordings of the original 20-second 911 call from Starbucks and radio traffic between officers who responded and dispatchers. In the 911 call, a woman said there were ""two gentlemen"" in the ""cafe who are refusing to make a purchase or leave."" In the subsequent radio traffic, a man reported a ""group of males"" was ""causing a disturbance"" before calling for backup and a supervisor. The police incident report, obtained Tuesday by the Inquirer and Daily News, notes that the two men cursed at the store manager and refused to leave even though officers asked ""multiple times."" It also accused the men of insulting police by saying, ""Cops don't know the laws,"" and ""Y'all make 45G a year,"" remarks to which Police Commissioner Richard Ross alluded in his explanation of the events, released in a Facebook video Saturday.

The city announced it would look into other incidents at the same Starbucks location.

Monday, April 16

Protests at the store on 18th and Market Streets continued, while CEO Kevin Johnson appeared on ABC's Good Morning America to issue a public apology. Johnson also flew to Philadelphia meet with the two men as well as government officials and community leaders.

Mayor Kenney and the Police Advisory Commission both said the officers who responded to the Starbucks followed procedures.

Sunday, April 15

Black Lives Matter protester Asa Khalif led a protest at the Starbucks at 18th and Spruce Streets where many demanded the firing of the employee who called police. About 75 people attended. ""I know the question has come up in terms of whether or not the manager should be fired, and we take full responsibility,"" Starbucks regional vice president Camille Hymes said. ""We put her in a position that did not allow her to be set up for success – or those two men."" A photo of Khalif armed with a bullhorn inside of the store, taken by Inquirer photographer Michael Bryant, would later be widely used on Twitter as a meme.

Friday, April 13 – Saturday, April 14

National outrage over the viral video began to mount. Many took to social media to call the incident racist, while the hashtags @boycottStarbucks and #StarbucksWhileBlack become widely used. Police Commissioner Richard Ross took to Facebook to stress that the arresting officers did nothing wrong. Later that night, CEO Kevin Johnson penned a letter to the company's ""partners and customers,"" noting that the ""disheartening situation"" ""led to a reprehensible outcome."" ""I am heartbroken to see Philadelphia in the headlines for an incident that — at least based on what we know at this point — appears to exemplify what racial discrimination looks like in 2018,"" Mayor Kenney said in his own statement. ""For many, Starbucks is not just a place to buy a cup of coffee, but a place to meet up with friends or family members, or to get some work done. Like all retail establishments in our city, Starbucks should be a place where everyone is treated the same, no matter the color of their skin."" Police and the company began separate investigations.

Thursday, April 12"
