link,title,date,source,text
https://www.inquirer.com/philly/news/starbucks-philadelphia-arrests-black-men-video-viral-protests-background-20180416.html,What happened at Starbucks in Philadelphia?,16/04/2018,https://www.inquirer.com,"Starbucks drew national outrage over the weekend after two black men waiting for an acquaintance in a Philadelphia store were arrested for trespassing. Charges ultimately weren’t filed. Read more

The arrests of two black men at a Philadelphia Starbucks last week has prompted nationwide outrage, protests at the store at 18th and Spruce Streets and the departure of the manager who called police to the coffee shop.

If you're just catching up on the story, here's a guide to what happened to spark the controversy (follow along here for the latest developments on the situation):

The men were waiting for an acquaintance at a Center City Starbucks when they were arrested

The two men, whose identities remain unknown, were sitting at a table at the Starbucks at 18th and Spruce Streets on Thursday afternoon. They were waiting for an acquaintance, but didn't make any purchases. When they refused to leave, a store manager called police, who arrested both men and led them out of the store in handcuffs. No charges were filed, as Starbucks declined to prosecute.

Video of the arrest went viral

A video of the arrests was posted to Twitter by Philadelphia-based author Melissa DePino, which quickly went viral and sparked outrage nationwide. The video has been viewed nearly 10 million times.

Philadelphia real estate investor Andrew Yaffe asked why officers were called and attempted to explain to police that the two men were waiting for him.

Advertisement

""What did they get called for, because there were two black guys sitting here, meeting me?"" Yaffe asked. ""What did they do?""

Second video of the arrest show the two men were calm

A longer video of the two arrests shot from a different angle doesn't reveal anything before the moment police arrive. But it shows the two men remained calm throughout the entire encounter with police, including when they were handcuffed and led out of the store.

The second video also shows more of the back-and-forth between police officers and customers inside the Starbucks location, though the noise of the crowd makes it difficult to hear what was said.

Starbucks’ CEO came to Philadelphia

In an interview with the Inquirer and Daily News, Starbucks CEO Kevin Johnson called incident ""reprehensible,"" vowing to work with store managers and employees to address any ""unconscious bias"" across the coffee chain. He made similar statements in an interview on Good Morning America.

Johnson is in Philadelphia, and said he hopes to offer a face-to-face apology to the two men. Johnson is also set to meet with Mayor Kenney and Police Commissioner Richard Ross and other community leaders Monday, a spokeswoman for the Seattle-based company said.

Philadelphia’s police chief said his officers did nothing wrong

In a video posted to Facebook on Saturday, Police Commissioner Richard Ross defended the officers involved in the arrest, stating they acted appropriately, though he added the incident was yet another reason the city should expand the department's body camera program.

""The police did not just happen upon this event — they did not just walk into Starbucks to get a coffee,"" Ross said in a video posted to Facebook Saturday. ""They were called there, for a service, and that service had to do with quelling a disturbance, a disturbance that had to do with trespassing. These officers did absolutely nothing wrong.""

John McNesby, president of Fraternal Order of Police Lodge 5, also defended the officers involved in the incident, saying they ""acted very professionally.""

""I can't control what people think,"" McNesby said of the controversy surrounding the arrests, adding that the officers ""did their job.""

Police spokesman Troy T. Brown said the department's internal affairs investigation is ""active and ongoing.""

Mayor Kenney has called for a city review of Starbucks’ policies

Kenney said in a statement calling for a review of Starbucks policies that the incident ""appears to exemplify what racial discrimination looks like in 2018.""

""Like all retail establishments in our city, Starbucks should be a place where everyone is treated the same, no matter the color of their skin,"" he said. ""Starbucks has issued an apology, but that is not enough."""
https://www.nbcnews.com/news/us-news/two-black-men-arrested-philadelphia-starbucks-meet-ceo-n866291,Starbucks CEO meets with two black men arrested in Philadelphia store,16/04/2018,https://www.nbcnews.com,"The CEO of Starbucks on Monday met with two black men who were arrested at one of his shops in Philadelphia, as accusations of racism grew against the mammoth coffee chain.

The quickly planned meeting came amid a second day of protests in the City of Brotherly Love, after video of the two getting arrested on suspicion of trespassing went viral.

A spokesperson for Starbucks confirmed to NBC News that the private meeting with CEO Kevin Johnson happened on Monday but no additional details were immediately provided.

On Monday morning, speaking to ABC’s ""Good Morning America,"" Johnson had called the arrests ""reprehensible"" and said he wanted to meet with the men to discuss ""a constructive solution.”

He also said he will order store managers to undergo training on how to spot ""unconscious bias"" — something that has been implemented in many police departments across the nation as well as other corporations, such as Facebook, to help educate employees not act upon subconscious stereotypes.

Previously, Johnson appeared in a video apologizing to the men and promising changes at the company.

The two men, whose identities have not been released, were arrested Thursday after a Starbucks manager called 911 because they were sitting inside the store, had not bought anything and refused to leave, according to police.

The store manager who called police ""is no longer at that store,"" a Starbucks spokesman told NBC News Monday afternoon, but did not give any further detail. It was not immediately clear whether the manager had been fired.

About two dozen protesters gathered outside the coffee shop in the pouring rain, starting before 7 a.m. on Monday, alleging racism by both the baristas and the police. Inside the store it looked like business as usual, however most of the people sitting at the tables were regional leaders from the company's corporate side, according to The Associated Press.

Just before 7:30 a.m., the protesters moved inside and stood in front of the counter, some holding banners reading ""End Stop and Frisk"" and chanting slogans like, ""A whole lot of racism, a whole lot of crap, Starbucks coffee is anti-black.""

Protester Shani Robin told NBC News that the demonstrators want the manager who called police and the arresting officers fired.

“If you can’t even go into a Starbucks to wait for a friend to come, you’re not safe anywhere,” she said.

“We're going to occupy space, we're going to make it very uncomfortable until they make changes and until specifically they meet the demands we set forth,” Robin added.

Another protester, Abdul-Aliy Muhammad, toldthe AP, ""We don't want this Starbucks to make any money today. That's our goal.""

While in Philadelphia on Monday, Johnson, the Starbucks CEO, met with Mayor Jim Kenney and other city leaders.

Kenney told reporters after the meeting that he was happy that the company met with officials and that Starbucks was ""contrite.""

""They're going to examine their guidelines and make sure that this doesn’t happen again and they were very contrite and sorry for what happened, and we’ll work with them going forward,"" he said.

Councilman Kenyatta Johnson said during a news conference that he would ""wait and see"" if the company actually implemented change.

""To me it was all lip service. I'm not sold,"" he said.

The councilman, who is black, added that he wanted to ""see an actual plan"" to ensure that people could go to Starbucks ""without fear of being targeted because of their skin color.""

Also on Monday afternoon, the NAACP said in a statement that the arrests represented ""another ominous signal on the increasingly dangerous environment for African-Americans.""

""The Starbucks situation provides dangerous insight regarding the failure of our nation to take implicit bias seriously,"" the NAACP said.

On Sunday, demonstrators carried megaphones and signs with phrases like “Too Little Too Latte” and confronted the employees behind the register, according to NBC Philadelphia.

Black Lives Matter activist Asa Khalif protests inside a Starbucks on Sunday in Philadelphia. Michael Bryant / Philadelphia Inquirer, via AP

Philadelphia Police Commissioner Richard Ross, who is black, said Saturday that the men hadn't purchased anything and refused to leave, which led to the arrest. The men were eventually let go after about eight hours in police custody; Starbucks did not press any charges.

Michelle Saahene, who witnessed the incident, told NBC News on Sunday that after the men were not permitted to use the bathroom because they had not purchased anything, they sat at a table silently while using their phones as they waited for a friend.

""The cops were asking them to leave because they weren’t purchasing anything,"" Saahene said. ""This is a Starbucks. Since when are people asked to leave a Starbucks who are just sitting there?"""
https://www.cnn.com/2018/04/16/us/philadelphia-police-starbucks-arrest-protests/index.html,"Starbucks arrests: Cafe shut down after protesters enter, chanting ‘Starbucks coffee is anti-black!’",16/04/2018,https://www.cnn.com,"CNN —

Anger over two black men being perp-walked out of a Philadelphia Starbucks continued to simmer Monday, with protests that briefly shut the location down, a sit-in and critical comments from African-American leaders.

During the early demonstration that forced the store to close, protesters called the mammoth coffee chain “anti-black.” The store reopened hours later.

As the protests heated up, the arrested men, who were not charged with a crime despite being detained, agreed to meet with Starbucks’ CEO Kevin Johnson. And the Philadelphia police commissioner, who is under fire for defending his officers, said the policemen never wanted to arrest the men.

The men, who have not been identified, initially asked to use the restroom inside the Starbucks on Thursday but were told the cafe’s bathrooms were for customers only. They then occupied a table without making a purchase, which many observers have noted is a common occurrence at the franchise’s locations.

A manager called police after the men declined to leave the premises because, they said, they were waiting for an acquaintance.

That manager is no longer working at the store, Starbucks said, but it’s unclear if she was terminated or relocated.

‘We want to see action’

Philadelphia Councilman Kenyatta Johnson and other African-American leaders denounced the chain Monday afternoon in front of the Rittenhouse Square location, where the incident occurred.

Johnson said he met with the Starbucks CEO and Philadelphia Mayor Jim Kenney, but he was “not sold” on the actions Starbucks said it planned to take.

“To me it was all lip service,” said Johnson, whose district includes the Rittenhouse Square neighborhood.

“We want to see action,” the councilman said. “We want to see an actual plan to make sure that those individuals that come to and from Starbucks … are respected, and they can go to the establishment without fear of being targeted because of their skin color.”

He said he believes if the two men “didn’t have sweatsuits on, they wouldn’t have been targeted.”

Johnson said city leaders are also demanding Starbucks engage in diversity and inclusion training and sensitivity training for all workers.

“We can’t find a reason for them being approached by this except for their skin,” said Minister Rodney Muhammad, president of the Philadelphia NAACP.

‘This is a societal issue’

Soon after, faith leaders and others filed into the store for a sit-in led by Philadelphians Organized to Witness, Empower and Rebuild, a community group. The crowd sang gospel songs and chanted before leaving the store.

As they prepared to march, one man said: “Starbucks, you can’t hide.”

“We can see your dirty side,” the crowd responded.

Starbucks’ policies, guidelines and procedures will be reviewed by the Philadelphia Commission on Human Relations, the mayor’s office said. The city’s Police Advisory Commission has also been asked to review all video of the incident and interview citizens and officers at the scene.

After meeting with Starbucks officials, including its CEO, Kenney said he believes the company will cooperate with the city’s probes.

“This is not just a Starbucks issue. This is a societal issue,” Kenney said in a statement.” People can react differently to others based on skin color, and that is wrong. We have work to do, and we need to do so productively.”

‘If we can’t get it, shut it down’

Hours earlier, a man also led protesters in call and response, in video captured by CNN affiliate KYW.

“Starbucks coffee is anti-black!”

“A whole lot of racism, a whole lot of crap!”

The next chant began, “Anti-blackness anywhere is anti-blackness everywhere!”

“What do we want?” the man asked.

“Liberation!” the protesters replied.

“When do we want it?”

“Now!”

The next chant – “If we can’t get it, shut it down” – spoke to the demonstrators’ demands. They are angry with Starbucks’ apology and the company’s promise to review its policies.

CEO calls arrests ‘reprehensible’

They bristled particularly at the sentence, “Our store manager never intended for these men to be arrested.” Why then, posited the protesters – as did their counterparts on social media – did the manager call police in the first place? And why, in the video of the arrests that went viral last week, is the manager not seen intervening, despite several customers taking the arresting officers to task?

Top cop: Men wouldn’t leave coffee shop

In the KYW video, a woman protesting in the store Monday tells customers, employees and her fellow protesters, “We are here today not just to bring attention to what Starbucks has done but to bring more attention, as if we needed it, to what the PPD continues to do. So we are very clear that corporations aren’t here for us and we’re also clear that the Philadelphia Police Department is not here for us, either.”

Other protesters off camera chime in, saying, “Not at all” and “Never been, never been.”

Police Commissioner Richard Ross has said previously his officers did nothing wrong and performed only “a service that they were called to do.”

Video Ad Feedback Police defend arrest of 2 men in Starbucks 01:43 - Source: KYW

On Monday, in an interview with CNN affiliate WPVI, Ross called the arrests “very unfortunate” and said his officers tried to avoid making an arrest but were left with no choice but to handcuff the men.

It’s common for officers to respond to reports that someone won’t leave a business, he said, adding that, typically, the person or people leave before police get there or when they arrive.

“Most people will move just simply because we tell them the proprietor wants you to leave. In this case, that was not the issue, and that’s for them to decide why they didn’t do that,” he told the station. “There are laws on the books that we have to follow. If we had our druthers, we wouldn’t (have) come there in the first place. That’s just keeping it simple.”

Protesters, Starbucks VP face off

The protesters did not appear to see any temperance in the officers’ actions, however. On their Facebook page – titled “Shut Down Starbucks!” – they alleged the Philadelphia police “have once again demonstrated their inherent white supremacy and inability to serve the black community.”

They demand the Starbucks manager who called police be fired and that the officers who arrested the men face the same fate.

They also want an official apology to the men and the black community at large and demand that “Starbucks create and publicize a new policy that expressly disallows calling the police on citizens,” according to the Facebook page.

When Camille Hymes, a regional vice president for the coffee behemoth, asked to speak to protesters in the store Monday, she was rebuffed.

“We know that you don’t have the power to change everything. You’re just a figurehead, but we’re going to get to those in power and we’re going to make sure that we shut you down,” a protester told Hymes in the KYW video.

On Sunday, another KYW video showed Hymes asking protesters to leave the store when her conversation with them went sideways.

“We put (the manager) in a position that did not allow her to be set up for success or those two men,” Hymes told the crowd, explaining that Starbucks’ policies, and not its employees, drove the arrests.

A man in the store yelled, “They got a picture in the system now! They’re fingerprinted!”

Asa Khalif of Black Lives Matter in Pennsylvania refused to let the manager off the hook, telling Hymes, “She’s a racist bigot. I’m sorry. I’m calling her that. Until that element is removed from this store, there cannot be any dialogue. There can only be protest.”

Someone in the background asked Hymes, “Can you understand the lack of empathy for the manager when…,” but she didn’t finish her question.

“At this time, we’ll ask that you step outside,” Hymes told the protesters.

CEO doesn’t want to ‘point blame’

In an interview with WPVI, Khalif summed up protesters’ anger.

“Black people are met with aggression every time we are encountered with police. What that manager did was she put those men in danger,” he told the station.

Video Ad Feedback Starbucks CEO apologizes after arrest of 2 men 02:12 - Source: CNN

Starbucks CEO Johnson said in an apology posted on Facebook that he believes “that blame is misplaced.” On “Good Morning America,” he said he did not want to “point blame” for the arrests.

“My responsibility is to look not only at that individual but to look more broadly at the circumstances that set that up, to ensure that this never happens again,” he told “GMA.”

The timing of the meeting between Johnson and the two men who were arrested has yet to be determined. A spokesperson said it will ideally take place this week."
https://www.theguardian.com/us-news/2018/apr/16/arrest-of-two-black-men-at-starbucks-for-trespassing-sparks-protests,Arrest of two black men at Starbucks for 'trespassing' sparks protests,16/04/2018,https://www.theguardian.com,"Protesters targeted a Philadelphia Starbucks on Monday after two black men were arrested last week when a store employee called police to say the men were trespassing.

The protests followed the release of a video that showed the two men being arrested after a store manager called the police because they were sitting in the store without placing an order. The two said they were waiting for a friend who arrived just as they were taken away in handcuffs.

Witnesses said the two were refused access to the bathroom because they had not made a purchase but that another customer had just used the bathroom without buying anything. Another said she had been there for hours without making a purchase.

“We don’t want this Starbucks to make any money today. That’s our goal,” said Abdul-Aliy Muhammad, one of the protest’s organizers and co-founder of the Black and Brown Workers Collective, as protesters moved to the front counter shortly after 7am and chanted “Starbucks coffee is anti-black” and “We are gonna shut you down”.

The arrests have caused a PR crisis for Starbucks. Kevin Johnson, Starbucks’ CEO, said he was hoping to meet the mayor, police and hopefully the men who were arrested in an interview on Monday on ABC’s Good Morning America. Johnson called the arrests “reprehensible”.

“I’d like to have a dialogue with them so that I can ensure that we have opportunity to really understand the situation and show some compassion and empathy for the experience they went through,” he said.

The protesters gathered outside the store in the pouring rain, while inside it looked like business as usual. However, most people drinking coffee at the tables were regional leaders for the company’s corporate side.

Just before 7.30am, the protesters moved inside and stood in front of the counter, some holding banners reading “End Stop and Frisk”, chanting slogans such as: “A whole lot of racism, a whole lot of crap, Starbucks coffee is anti-black.”

Speeches decried police brutality and gentrification. Starbucks regional vice-president Camille Hymes attempted to talk to the protesters, but was shouted down.

Over the weekend, demonstrators called for the firing of the employee who had contacted police. Starbucks has removed the manager from the store and said told The Philadelphia Inquirer the separation was “mutual”.

Officials have said police officers were told the men had asked to use the store’s restroom but were denied because they had not bought anything and they refused to leave.

Police have not released the names of the men who were arrested and later released after the district attorney’s office said there was lack of evidence that a crime had been committed.

Over the weekend, the mayor of Philadelphia ordered a city commission to review policies at Starbucks after the arrests prompted social media users to accuse the company of racial discrimination.



View image in fullscreen Video posted to social media shows police officers arresting two black men as they sat in a Starbucks coffee shop in Philadelphia. Photograph: Melissa DePino

Protesters gathered outside the branch in downtown Philadelphia on Sunday, with a local preacher leading several dozen in chants of “I am somebody, and I demand equality now”.

“It is a shame that [in] the year 2018 we’re still putting up with this mess,” said the Rev Jeffrey Jordan. “This country was built on the backs of black and brown people and now Starbucks is going to treat us like we’re second class.”

The arrests on Thursday were captured on video and circulated widely on social media.

@Starbucks The police were called because these men hadn’t ordered anything. They were waiting for a friend to show up, who did as they were taken out in handcuffs for doing nothing. All the other white ppl are wondering why it’s never happened to us when we do the same thing. pic.twitter.com/0U4Pzs55Ci — Melissa DePino (@missydepino) April 12, 2018

Melissa DePino captured the incident on video and posted it on Twitter. She wrote: “The police were called because these men hadn’t ordered anything. They were waiting for a friend to show up, who did as they were taken out in handcuffs for doing nothing. All the other white ppl are wondering why it’s never happened to us when we do the same thing.”

The police commissioner, Richard Ross, said officers went to the coffee shop after Starbucks employee reported the men were trespassing. Officers were told the men had entered and asked to use the toilet, but were refused because they had not bought anything. They then refused to leave. Ross, who is black, insisted that his officers “did absolutely nothing wrong”.

Police have not released the names of the men. A spokesman for the district attorney’s office said the two were released “because of lack of evidence” that a crime had been committed, but declined to comment further, citing a police investigation.

Johnson said the company’s practices and training led to a “bad outcome”, and the reason for the call that brought police into the shop was incorrect.

He said the company would further train workers on when to call police and host a company-wide meeting to “underscore our longstanding commitment to treating one another with respect and dignity”.

"
https://www.nytimes.com/2018/04/16/us/starbucks-philadelphia-arrest.html,"Starbucks Employee Who Called Police on Black Men No Longer Works There, Company Says",16/04/2018,https://www.nytimes.com,"An employee who called the police to the downtown Philadelphia Starbucks where two black men were arrested last week is no longer working there, Starbucks said on Monday, as the company’s chief executive apologized for the “reprehensible” episode.

“We can confirm that she is no longer at that store,” a spokeswoman said, declining to name the employee or provide further details.

The chief executive, Kevin R. Johnson, said in an interview with ABC’s “Good Morning America” that what happened to the men was “wrong,” and that he wanted to meet with them personally to apologize.

“It’s my responsibility to understand what happened and what led to that, and ensure that we fix it,” Mr. Johnson said. He said that the company was reviewing its guidelines, which can differ among its 28,000 stores worldwide, and that it would invest in unconscious bias training."
