link,title,date,source,text
https://6abc.com/philadelphia-starbucks-arrest-police-department/3342444/,Philadelphia Starbucks arrests: What a witness says happened,14/04/2018,https://6abc.com,"Philadelphia Starbucks arrests: What a witness says happened

Both police and Starbucks are investigating after video of an arrest at a Philadelphia Starbuck went viral.

Both police and Starbucks are investigating after video of an arrest at a Philadelphia Starbuck went viral.

Both police and Starbucks are investigating after video of an arrest at a Philadelphia Starbuck went viral.

Both police and Starbucks are investigating after video of an arrest at a Philadelphia Starbuck went viral.

PHILADELPHIA -- Outrage is mounting after two men were arrested at a Philadelphia Starbucks, and an eyewitness said a manager escalated the situation by calling police instead of asking the men to buy something or leave.

Lauren, who asked that her last name not be used, shot video of the two men being arrested at the Starbucks just before 5 p.m. on April 12. She said the incident began after the men asked to use the bathroom and were told that it was only available for paying customers, which Philadelphia Police Commissioner Richard Ross later confirmed.

After the men had been ""quietly hanging out, chatting and waiting for their friend,"" she said officers entered the restaurant and asked the two men to leave, saying that they would be trespassing if they did not leave.

""The two young men politely asked why they were being told to leave and were not given a reason other than the manager wanted them to leave,"" she told ABC in an email.

The men told the officer that they were waiting for a friend to arrive and offered to call that friend to prove that they had legitimate business at the restaurant, she said.

At that point, she said several officers began to move tables and chairs around the two men and take them into custody.

The friend for whom the men were waiting then arrived and attempted to intervene, but police told him the men ""were not paying customers and thus were trespassing,"" Lauren recalled.

""The two men stayed calm and did not raise their voices once. Everyone else in the Starbucks, however, was appalled,"" she added.

Lauren said another woman had entered the Starbucks minutes before the men were arrested and was given the bathroom code without having to buy anything and that another person in the restaurant at the time of the incident ""announced that she had been sitting at Starbucks for the past couple of hours without buying anything.""

""These men were discriminated against and unjustly detained. Being a person of privilege, it's hard to believe things like this still happen in 2018,"" Lauren told ABC. ""Sometimes you don't fully believe it until you see it with your own eyes.""

The Philadelphia Police Department has launched an internal investigation into the incident, and Commissioner Richard Ross has said the officers had legal standing to arrest the men because Starbucks, the property owner, had asked to have them removed from their private property.

Watch Philadelphia Police Commissioner Richard Ross's full statement on the incident at a Philadelphia Starbucks, delivered via Facebook on April 14, 2018.

The men were eventually released from police custody, and the district attorney's office declined to press charges due to a ""lack of evidence that a crime was committed.""

Starbucks has since released a statement apologizing to the two men, adding that they are ""disappointed this led to an arrest"" and pledging to review their policies ""to ensure these types of situations never happen in any of our stores."""
https://www.vox.com/identities/2018/4/14/17238494/what-happened-at-starbucks-black-men-arrested-philadelphia,Two black men were arrested in a Philadelphia Starbucks for doing nothing,14/04/2018,https://www.vox.com,"Two black men were arrested and escorted out of a Philadelphia Starbucks on Thursday after staff called the police to report they refused to leave; the men hadn’t ordered anything and were reportedly waiting for a business associate to arrive. The staff reportedly called 911 because Starbucks does “not allow nonpaying people from the public to come in and use the restroom,” Philadelphia Police Commissioner Richard Ross told the Philadelphia Inquirer. The employees said the men were trespassing and had refused to leave the restaurant.

A video of the incident has swept across the internet and sparked widespread outrage, prompting Starbucks to issue a less-than-satisfying apology on Saturday afternoon. CEO Kevin Johnson issued a lengthy statement on the incident on Saturday evening and said he wants to meet personally with the men arrested to apologize.

The saga began when a video posted on Twitter on Tuesday showed police arresting two black men in Twitter for “doing nothing,” in the words of the user who posted the video. Two people — not the men — can be heard protesting as the police remove the men’s chairs and escort them out. “This is ridiculous,” one white man says to an officer in the video. The men do not protest.

The video has been viewed more than three and a half million times on Twitter since Thursday.

@Starbucks The police were called because these men hadn’t ordered anything. They were waiting for a friend to show up, who did as they were taken out in handcuffs for doing nothing. All the other white ppl are wondering why it’s never happened to us when we do the same thing. pic.twitter.com/0U4Pzs55Ci — Melissa DePino (@missydepino) April 12, 2018

Police responded to the call and to keep things from “getting out of hand,” he said, and asked the men to leave, as Starbucks did not want them there. Ross defended the officers, saying they “did absolutely nothing wrong,” but the police department said it was conducting an “internal investigation.”

We are aware of an incident that occurred on 4-12-18 at the Starbucks Café at 18th and Spruce. The entire incident, including the actions of the responding officers, is under internal investigation. Once we gather all the facts, we will comment further. — Philadelphia Police (@PhillyPolice) April 14, 2018

There are a lot of questions here, and they’re not just about the police.

The video of the incident shows at least six police officers taking the two men into custody — a high number, given they were doing nothing.

The obvious question: Beyond the police’s response, why were they called in the first place? People meet in Starbucks all the time, and they wait for others in the restaurant before ordering. Starbucks issued an apology on Saturday to the “two individuals and our customers” and said the company is “disappointed” that it led to an arrest. “We are reviewing our policies and will continue to engage with the community and the police department to try to ensure these types of situation never happen in any of our stores,” the statement says.

We apologize to the two individuals and our customers for what took place at our Philadelphia store on Thursday. pic.twitter.com/suUsytXHks — Starbucks Coffee (@Starbucks) April 14, 2018

Johnson in a longer statement released on Saturday evening reiterated the apology and said the company plans to investigate the incident and “make any necessary changes to our practices that would help prevent such an occurrence from ever happening again.” He said Starbucks is “firmly against discrimination or racial profiling” and that he hopes to meet the men “to offer a face-to-face apology.”

A second video from the Thursday incident posted on YouTube shows an extended version of what happened. The two black men who are ultimately arrested speak calmly to police. A third man, later identified real estate developer Andrew Yaffe, who is white, appears and protests.

“Does anybody else think this is ridiculous?” he asks, calling it “absolute discrimination.” Yaffee spoke with attorney Lauren Wimmer about the incident, and she talked to the Philadelphia Inquirer. “He was meeting with the two gentlemen at the Starbucks to discuss business,” Wimmer said Saturday, identifying Yaffe as a friend. “These two guys are business professionals in commercial real estate.”

Wimmer is representing the men who were arrested, who have not been identified publicly. She told the Inquirer she believes the reason for the arrest was “completely based on race” and noted there was “no indication any crime was being committed.”

Starbucks is not the first major restaurant chain to come under fire for racial discrimination. In 1994, Denny’s agreed to pay more than $54 million to settle racial discrimination lawsuits; in 2004, Cracker Barrel paid $8.7 million in discrimination lawsuits.

Update: Story updated with statement from Starbucks CEO Kevin Johnson."
https://www.npr.org/sections/thetwo-way/2018/04/14/602556973/starbucks-police-and-mayor-weigh-in-on-controversial-arrest-of-2-black-men-in-ph,"Starbucks, Police And Mayor Respond To Controversial Arrest Of 2 Black Men In Philly",14/04/2018,https://www.npr.org,"Starbucks, Police And Mayor Respond To Controversial Arrest Of 2 Black Men In Philly

Enlarge this image toggle caption Twitter Twitter

Updated at 1:56 p.m. ET

A video that's now amassed almost 7 million views on Twitter depicts police officers handcuffing two black men in a Philadelphia Starbucks.

Onlookers in the background are incredulous.

""What did they do?"" one man asks.

""They didn't do anything,"" a woman responds. ""I saw the entire thing.""

@Starbucks The police were called because these men hadn’t ordered anything. They were waiting for a friend to show up, who did as they were taken out in handcuffs for doing nothing. All the other white ppl are wondering why it’s never happened to us when we do the same thing. pic.twitter.com/0U4Pzs55Ci — Melissa DePino (@missydepino) April 12, 2018

In a video statement streamed on Facebook Live from the Philadelphia Police Department's page, Commissioner Richard Ross confirmed that on Thursday afternoon at 4:40 p.m., Philadelphia police received a 911 call from the Starbucks at 18th and Spruce Streets alleging disturbance and trespassing.

When police arrived, two Starbucks employees told them two men had asked to use the restroom but were told they couldn't because they hadn't purchased anything. The men allegedly refused to leave after being asked by Starbucks employees. Ross also said the two men refused to leave after being asked three times by police officers.

So, Ross says, officers arrested the men. The attorney for the two men, Lauren Wimmer, told the Philadelphia Inquirer she received word that the two were being released from custody at 12:30 a.m. Friday, nearly eight hours after the initial 911 call. Ross confirmed that the officers released the men from custody after they discovered Starbucks was not planning to prosecute them.

In his statement, Ross said he believed the officers ""did absolutely nothing wrong."" He continued:

""[The police officers] followed policy, they did what they were supposed to do, they were professional in all their dealings with these gentlemen and instead, they got the opposite back. I will say that as an African American man, I am very aware of implicit bias. We are committed to fair and unbiased policing and anything less than that will not be tolerated in this department.""

Ross said all commanders in his department receive implicit bias training, and all new recruits are sent to both the National Museum of African American History and Culture and the United States Holocaust Memorial Museum in Washington, D.C. ""We want them to know about the atrocities that were, in fact, committed by policing around the world,"" he says.

A police spokesman told the Inquirer that the Philadelphia Police Department's internal affairs unit is looking into the incident.

In a statement released Saturday, Philadelphia's mayor Jim Kenney criticized Starbucks for its role in the arrests:

""I am heartbroken to see Philadelphia in the headlines for an incident that — at least based on what we know at this point — appears to exemplify what racial discrimination looks like in 2018. For many, Starbucks is not just a place to buy a cup of coffee, but a place to meet up with friends or family members, or to get some work done. Like all retail establishments in our city, Starbucks should be a place where everyone is treated the same, no matter the color of their skin.""

The mayor's statement says Starbucks' apology, which the company issued on its Twitter account earlier Saturday, was not enough. Kenney also says he has asked the Philadelphia Commission on Human Relations to look into whether additional implicit bias training should be required of Starbucks employees, and his office has reached out to Starbucks directly to discuss the matter.

We apologize to the two individuals and our customers for what took place at our Philadelphia store on Thursday. pic.twitter.com/suUsytXHks — Starbucks Coffee (@Starbucks) April 14, 2018

Mayor Kenney's statement referenced ongoing discussions about criminal justice, policing and incarceration in Philadelphia:

""Commissioner Ross and his team have promised a review of their policies moving forward with regards to response to complaints like this. I believe a thorough review is fully warranted given the unfortunate outcome of this event, particularly at a time when our criminal justice reform efforts are focused on avoiding needless incarcerations.""

The reforms Kenney alludes to have a lot to do with the city's new progressive District Attorney Lawrence Krasner. WHYY's Bobby Allyn recently reported on the change Krasner is pushing for in Philadelphia:

Krasner is a former civil rights lawyer who rode into office on a platform of radically revamping the city's district attorney's office by opposing the death penalty, stepping away from cash bail and seeking shorter prison sentences for offenders.

On Sunday, one day after Kenney criticized Starbucks' Twitter apology, Starbucks CEO Kevin Johnson released a statement of his own, saying that he will be soon joining other executives already in Philadelphia to speak with those involved in the incident. ""I hope to meet personally with the two men who were arrested to offer a face-to-face apology,"" his statement reads.

The executive added that the company has begun an investigation into its practices, and will ""further train"" its staff to ""better know when police assistance is warranted."""
https://www.cnn.com/2018/04/14/us/philadelphia-police-starbucks-arrests/index.html,"As Starbucks apologizes for treatment of black patrons, police go on the defensive and activists call for justice",14/04/2018,https://www.cnn.com,"CNN —

A viral video of two black men being arrested at a Philadelphia Starbucks has elicited three very different responses from police, the company and community members.

In the video, which was posted to Twitter Thursday by Philadelphia resident Melissa DePino, two black men can be seen being escorted out of the coffee shop in handcuffs. Customers can be seen and heard telling officers that the men did nothing wrong.

Included with her tweet, DePino wrote: “The police were called because these men hadn’t ordered anything. They were waiting for a friend to show up, who did as they were taken out in handcuffs for doing nothing.”

Here’s how stakeholders have so far responded:

Police commissioner says officers did ‘nothing wrong’

Philadelphia Police Commissioner Richard Ross defended the actions of officers in the video saying his officers “did absolutely nothing wrong.”

In a statement on Facebook Live, Ross said that Starbucks employees called 911 to report a trespassing complaint.

The employees told officers the two men wanted to use the restroom but were told the facilities are only for paying customers. The Starbucks employees then asked the men to leave, but they refused, Ross said.

Officers responded and asked the men three times “politely to leave the location because they were being asked to leave by employees because they were trespassing.” When the men again refused to leave, they were arrested “without incident,” Ross said.

The men were taken to a police station and released when it became clear Starbucks didn’t want to press charges.

“They did a service that they were called to do,” Ross said of the officers. “And if you think about it logically, that if a business calls and they say that someone is here that I no longer wish to be in my business, (officers) now have a legal obligation to carry out their duties. And they did just that.”

Ross, who is black, referenced his own experiences while making his case, saying, “As an African-American male, I am very aware of implicit bias.”

“We are committed to fair and unbiased policing and anything less than that will not be tolerated in this department.”

Starbucks CEO apologizes for ‘reprehensible’ incident

Starbucks CEO Kevin Johnson called the incident “reprehensible” and outlined steps the company would take to “help prevent such an occurrence from ever happening again.”

“Starbucks stands firmly against discrimination or racial profiling,” Johnson said in a statement Saturday. “I hope to meet personally with the two men who were arrested to offer a face-to-face apology.”

Johnson said Starbucks’ “practices and training led to the bad outcome” with the two men being arrested.

“The basis for the call to the Philadelphia police department was wrong,” he said. “Our store manager never intended for these men to be arrested and this should never have escalated as it did.”

Earlier, the company tweeted an apology, saying “We take these matters seriously and clearly have more work to do when it comes to how we handle incidents in our stores.”

We apologize to the two individuals and our customers for what took place at our Philadelphia store on Thursday. pic.twitter.com/suUsytXHks — Starbucks (@Starbucks) April 14, 2018

A company-wide meeting will be held this week, Johnson said, to share what was learned from the incident, discuss next steps and “underscore our long-standing commitment to treating one another with respect and dignity.”

Philly activists and community call for justice

Members of Black Lives Matter PA held a demonstration at the Philadelphia Starbucks store on Sunday. The rally started outside Starbucks; protesters then went inside to confront the manager.

Asa Khalif of Black Lives Matter called it the “People’s Protest,” according to CNN affiliate WPVI-TV.

“Black and brown people deserve to have a safe space without being profiled. Shoutout to the white allies who stood up and saw injustice and fought against it challenging the police. That’s what this is about,” Khalif said.

Message to the @Starbucks in Philadelphia....Our city is shining bright like a diamond right now. Please make this situation right. I repeat please make this situation right!!!!!!! Once again MAKE THIS RIGHT — Kevin Hart (@KevinHart4real) April 15, 2018

Celebrities and politicians are also calling for action. Comedian Kevin Hart, a Philadelphia native, tweeted Sunday that Starbucks needed to “make this situation right.”

Philadelphia Mayor Jim Kenney said Starbucks’ apology “is not enough.”

He said he “asked the Philadelphia Commission on Human Relations to examine the firm’s polices and procedures, including the extent of, or need for, implicit bias training for its employees.”

Kenney said he’s “heartbroken to see Philadelphia in the headlines for an incident like that,” which he says “appears to exemplify what racial discrimination looks like in 2018.”

“Starbucks should be a place where everyone is treated the same, no matter the color of their skin,” Kenney says."
