link,title,date,source,text
https://www.washingtonpost.com/business/economy/starbucks-arrests-who-gets-to-decide-whether-youre-a-patron-or-a-trespasser/2018/04/17/f0aa99de-41ac-11e8-ad8f-27a8c409298b_story.html,Starbucks arrests: Who gets to decide whether you’re a patron or a trespasser?,17/04/2018,https://www.washingtonpost.com,"Public outrage over the arrest of two African American men at a downtown Starbucks sparked a corporate crisis that led the company to take the unprecedented step of announcing it would close more than 8,000 stores for an afternoon in May to train baristas on how to recognize their racial biases.

The scene of two black men in handcuffs being led out of the Philadelphia coffee shop by police last week delivered an uncomfortable reminder of the country’s racial disparities.

The incident illustrates a pervasive bias that can affect even the most mundane activities in U.S. public spaces — in this case, meeting someone for a coffee. The two men were waiting for a business associate when the manager called the police.

Nowhere else in Philadelphia are African Americans more disproportionately stopped by police than in the Center City neighborhood surrounding the Starbucks, two blocks from ritzy Rittenhouse Square, where rents in luxury apartments run as high as $10,000 a month.

Advertisement

While African Americans make up 3 percent of the area’s residents, they account for 67 percent of pedestrian police stops, according to a 2017 analysis by the American Civil Liberties Union, which has monitored racial disparity in Philadelphia policing for eight years. Most of those stopped were never charged.

Similar racial disparities in citations and arrests for commercial trespassing occur across the country, according to lawyers and civic leaders.

In Grand Rapids, Mich., African Americans make up 21 percent of the population but accounted for 59 percent of commercial trespassing arrests at businesses such as gas stations and bars, according to the ACLU, which filed a federal lawsuit against the city in 2013.

In Washington, businesses in Georgetown operated a private messaging app that allowed retailers to alert police officers about people they considered suspicious. The vast majority of suspicions in the wealthy, predominantly white community were about black people, some of whom were described in offensive language. The service was suspended in 2015 after concerns arose about racial profiling.

Advertisement

“It raises all kinds of questions. How long can you be on a property? Can you not browse at these stores now? Who gets to determine whether you’re acting as a patron or as a trespasser?” said Jason D. Williamson, senior staff attorney with the ACLU’s Criminal Law Reform Project, referring to the disproportionate targeting of African Americans. “It goes to the judgments that are made not only by the police but by store owners who ratchet up the level of suspicion depending on what you look like.”

For many African Americans, particularly young black men, the pervasive scrutiny means never letting down their guards while shopping, dining or gathering with friends, Williamson said.

This vigilance may translate into always asking for a receipt and shopping bag, even as municipalities impose small charges for plastic bags. Or dressing in a collared shirt simply to run weekend errands. Or being mindful not to linger for too long in a store.

“It’s the day-to-day opportunity costs of being black in America,” said Rashad Robinson, executive director of Color of Change, a nonprofit advocacy group.

Advertisement

Kevin Harden Jr., a 32-year-old lawyer who works near Rittenhouse Square, said he often is ignored by wait staff when he trades in his three-piece suits for jeans and Timberland boots on weekends.

“The employees frequently don’t have the ability to delineate between a homeless person and a black professional when I have on jeans,” Harden said. “They lack cultural competency. It’s like an invisibility when I’m seeking service, but they see me when they dislike me.”

In the Starbucks case, one or both of the men had asked to use the restroom before they purchased anything. A Starbucks employee told the men that the company policy was to refuse the use of bathrooms to non-customers and asked the men to leave, according to an account by Philadelphia Police Commissioner Richard Ross.

The manager called the police when the men did not leave. Police handcuffed the men and led them out of the store, a scene captured by bystanders’ cellphones. They were released early the next morning with no charges filed.

Advertisement

Starbucks chief executive Kevin Johnson apologized to the men in person this week for what he called the “reprehensible” circumstances that led to their arrest. The company also removed the manager who called police.

Ross, who is black, has defended his police department’s handling of the case, describing the officers’ response as “professional.”

“These officers did absolutely nothing wrong. They followed policy; they did what they were supposed to do,” Ross said on Facebook Live on Saturday.

Craig M. Straw, Philadelphia’s first deputy city solicitor, said the city and police department have been working with the ACLU to cut in half the number of pedestrian stops without reasonable suspicion since 2016.

Officers who have consistently high numbers of inappropriate stops are disciplined, from verbal counseling to suspension.

Advertisement

Straw acknowledged that despite the reduced number of stops, the racial disparities remain. He said experts who have examined the data disagree on whether race played a predominant role in the stops.

Jeannine Deni, store manager at a Barnes & Noble in Center City, said people are welcome to read in the bookstore or sit in its second-floor cafe for as long as they would like without making a purchase. Restrooms are also open to the public.

She said the store rarely involves the police, doing so only when visitors are harming themselves or others.

Deni said it is important that people in the community know the store is a safe place.

“It all comes down to behavior,” Deni said. “If you’re sitting and reading a book, that’s what you’d expect to see in a bookstore.”

At a McDonald’s near Rittenhouse Square, a sign alerts customers to the store’s 20-minute time limit for consuming food. “PLEASE — NO LOITERING,” the sign said in bold, capital black letters.

Advertisement

Latasha Adams, a manager at the restaurant, defended the restaurant’s policies on loitering and trespassing. Almost once a day, Adams says, employees have to escort an unruly visitor or patron out of the store.

Adams said the time limit is necessary even for paying customers who keep to themselves, to prevent them from “taking advantage of the situation.”

“The customer doesn’t like it when people trespass,” Adams said. “It kind of hurts our business because who wants to eat here when you have a trespasser just chilling in here, just taking up spaces that are supposed to be for the customers?”

But Mary Catherine Roper, deputy legal director of the ACLU of Pennsylvania, said some business owners use law enforcement to “frighten away people they don’t want there.”

Share this article Share

“Businesses call police all the time to keep people who they don’t like the looks of from congregating in front of their store,” Roper said. “It’s homeless people, not only African Americans.”

The ACLU of Pennsylvania filed a 2010 lawsuit against the Philadelphia Police Department for racial profiling, although Roper said the force had improved its practices in recent years and no longer stops people solely for “loitering.”

Advertisement

Local teenagers Gabriel Bangert, 15, and Steven Gregory, 15, said it was only a matter of time before a racial-profiling incident in Center City garnered national attention.

Bangert, who identifies as white, black and Puerto Rican, said he’s witnessed police ask black men playing Frisbee in Rittenhouse Square to leave for “talking loudly.”

Gregory, who is Guatemalan, said that two months ago an African American classmate was asked to leave the Starbucks, which is near their school, after not buying anything.

While the recent arrests have drawn national outrage, Gregory said the mistreatment of black customers is hardly isolated to that one store or chain — or indeed to Philadelphia.

“It happens a lot,” he said.

In Grand Rapids, the 2013 lawsuit stemmed from the police department’s longtime practice of relying on “no-trespass letters” signed by business owners to deter crime. Police used the program to justify stopping, questioning and sometimes searching individuals who they deemed did not have a legitimate business purpose to be on the property — even without speaking with the business owner or any employee about the person. Police considered the program a valuable law enforcement tool designed to combat low-level crime.

Advertisement

“The fact that a store had a no-trespass letter in the window cannot be enough to give police the authority to stop someone,” Williamson said.

The city changed its policy in 2017 to prohibit police from using no-trespass letters as the sole basis for a pedestrian stop.

Derrick Johnson, president of the NAACP, said that until U.S. society addresses the issue of implicit bias, the disproportionate wrongful arrests of African Americans will continue.

“It’s an ever-present threat to one’s freedom,” Johnson said. “Our ability to express ourselves freely is drastically hampered by the fact that someone could interpret malicious motives just because we exist or appear a certain way.”"
https://www.usatoday.com/story/money/business/2018/04/17/hear-911-call-led-starbucks-arrests-two-african-americans/526255002/,Starbucks' 911 call that led to Philadelphia arrests of two black men,17/04/2018,https://www.usatoday.com,"Philadelphia police have released recordings of the 911 call and radio voice-communications exchanges that led to the arrest of two African-American men at a Starbucks, resulting in calls for a boycott of the coffee chain.

In the 4:37 p.m. ET 911 call from last Thursday, a Starbucks employee, believed to be the manager, asks police to come to the store.

""I have two gentlemen in my cafe that are refusing to make a purchase or leave. I am at the Starbucks at 18th and Spruce,"" the employee said.

That call set events in motion that would lead to series of apologies by Starbucks, saying it should never have been placed; an afternoon of racial bias training at almost 8,000 stores scheduled for next month and angry protestors descending on the store amid calls for a boycott.

At the Starbucks store that afternoon, the two men explained they were waiting for a friend. One had asked for access to a restroom and was denied because he hadn't bought anything. The manager then called police even though Starbucks, with its comfy chairs and usually ample electric outlets for computers, has never shunned being a community meeting spot.

The incident raised issues of whether Starbucks has a double standard because of the belief that white men or women wouldn't have been asked to leave if they hadn't ordered food or drink.

More:Starbucks closing U.S. stores on May 29 for racial-bias training

More:Arrest of two black men at Starbucks sparks debate on race in retail

More:Black man videotapes Starbucks' refusal to let him use restroom

In the recording, a police car is dispatched. Officers ask for backup and a supervisor due to a ""disturbance at the Starbucks"" involving a ""group of males."" Officers then indicate they are going to make arrests and transport the pair.

When the officers arrived, a patron videotaped the incident. The tape shows the pair's friend, who is white, arriving and questioning why the arrests are taking place. The two men remain calm as they are handcuffed and led away.

Starbucks didn't press trespassing charges. The pair were later released."
https://www.washingtonpost.com/news/the-watch/wp/2018/04/17/what-white-people-can-learn-from-the-starbucks-arrests/,Opinion | What white people can learn from the Starbucks arrests,17/04/2018,https://www.washingtonpost.com,"Last week, two black men were arrested at a Philadelphia Starbucks. According to media interviews from those who were there, the men were there to meet a friend. At some point, the two men were denied the use of the store’s bathroom and then asked to leave. When they refused, an employee called the police. They were arrested on suspicion of trespassing and detained for eight hours before they were released without charges. Cellphone video of the arrests went viral, sparking protests and both a personal apology and a promise from Starbucks CEO Kevin Johnson to train employees for “unconscious bias.”

By all accounts, the two men did nothing to provoke their arrests, other than remain at a Starbucks after being asked to leave. It also isn’t clear why they were asked to leave. Starbucks of course isn’t obligated to provide space in its store for non-customers, but it isn’t as if this is a policy that the chain strictly enforces. The two men certainly seem to have been singled out because of their race.

Reaction to the story has been pretty universally condemnatory of both the Starbucks staff and the Philadelphia police officers who made the arrest. Philadelphia Police Commissioner Richard Ross (who, given the subject matter, it’s worth noting is black) has been one of the few to publicly defend the officers. In a statement on Facebook Live, Ross said the police “did absolutely nothing wrong,” adding, “They did a service that they were called to do. And if you think about it logically, that if a business calls and they say that someone is here that I no longer wish to be in my business, [officers] now have a legal obligation to carry out their duties. And they did just that.”

Advertisement

But of course not everyone accused of trespassing gets arrested. Police officers have discretion in how to resolve disputes such as this. Here, it’s relatively ambiguous what does and does not constitute trespassing. Yes, the men were asked to leave. But they were asked to leave a public facility open to everyone else but them, and for reasons that smacked to them of bias. It isn’t as if they climbed a fence and ignored “No Trespassing” signs. At the end of the day, if two men can be arrested and detained for eight hours for refusing a barista’s order to leave, then there’s something wrong with the policy. The near-universal outrage over the incident is also a good indication that the policy needs to change.

After an initial milquetoast apology, Starbucks executives have been much more contrite. The company announced it would close more than 8,000 stores on May 29 for “racial-bias education. Philadelphia Mayor Jim Kenney said he was “heartbroken” over the arrests but put the blame more on Starbucks than on city police.

That this incident could generate so much outrage and national attention is encouraging. Too often when an incident like this happens, you see the usual breakdown along ideological lines — white conservatives back the police, while most people of color and left-leaning white people support those whom the police are accused of harassing, beating or shooting. This one seems to have inspired pan-partisan condemnation.

Advertisement

But before we get too self-congratulatory about our wokeness, imagine that these two black men came forward to say they had been wrongly arrested, but there was no video and no white people in the Starbucks corroborated their story. My guess is that a good percentage of white people would assume they had done something to provoke the cops. They were probably too loud. Maybe they were harassing other customers. Perhaps they tried to take something without paying. Much of white America just isn’t ready to believe that black people can get arrested, harassed by cops or beaten for doing little to nothing.

A couple of years ago, South Carolina Sen. Tim Scott, a conservative Republican, took to the floor of the U.S. Senate to describe the harassment he and some of his staff had received from police simply for being black men who drove nice cars. Some white conservatives took notice. Tim Scott is no Al Sharpton; no one could accuse him of benefiting from racial grievance. But of course Scott can’t be the only black person telling the truth about bad interactions with cops.

It’s true that the problems with policing — and more broadly with our criminal-justice system — aren’t inflicted exclusively on black and Latino people. White people are sometimes victimized, too. But one thing I’ve noticed in covering policing issues for the past 10 years or so is that nearly every person of a color has a story about a bad interaction with police. They were stopped, then thoroughly and embarrassingly searched on the side of the road. A cop mistook something they were holding for a gun. They were wrongly arrested. They were roughed up. A traffic stop suddenly turned very scary. If it didn’t happen to them, it happened to a brother, a father or a close friend.

Advertisement

There’s a faction of white people who are legitimately concerned about some of these issues but who want to ignore the racial component of them. These white people will sometimes ask why no one was marching in the streets after the police shooting deaths of Daniel Shaver or Justine Damond, or legitimately ask why it’s considered bad form to say “All Lives Matter” instead of that “Black Lives Matter.” When I’ve interviewed the families and friends of white people killed by police, there can sometimes be an understandable feeling of isolation. Black Lives Matter is there for the black victims; who is marching for the white victims?

The difference, again, is that many white people tend to think that for a cop to shoot you, or beat you, or arrest you, you must have provoked them in some way. Don’t want police attention? Don’t commit crimes. Don’t hang with the wrong crowd or project an aura of violence and intimidation. Be polite and courteous when interacting with police. Do what you’re told, and you’ll be fine. At worst, the most egregious police shootings of white people may be tragic, but they’re rare. They’re anomalies. We can’t empathize with the person who was shot because we can’t imagine a scenario in which a cop might consider us potentially dangerous. And that’s because we just don’t do the sorts of things that cause cops to shoot people.

When many black or Latino or, in some parts of the country, Native American people read about a police shooting of someone like them, the reaction is often more “That could have been me. “There are no precautions to take. It isn’t about not hanging with the wrong crowd, or not talking back to cops, or not engaging in criminal behavior. The “sorts of things” they do that attract police attention are things such as being a U.S. senator driving a nice car, standing outside of a store, walking home after a long shift at a restaurant, trying to make a living by selling CDs, or waiting for a business associate at a Starbucks. It is simply to exist.

Advertisement

Sometimes the viral video doesn’t tell the whole story. Sometimes it tells us all we need to know. But we shouldn’t need a viral video and the word of white witnesses to understand that being black or brown often means negotiating an entirely different landscape when it comes to the police (as well as the white people who tend to call the police after seeing black people behave in a way that’s even the slightest bit abnormal).

Share this article Share"
https://slate.com/news-and-politics/2018/04/how-raced-spaces-explain-the-philadelphia-starbucks-arrests.html,The arrest of two men at a Philadelphia Starbucks shows how deeply raced our public spaces can be.,17/04/2018,https://slate.com,"Philadelphia is a city in which 43 percent of residents are black. The Philadelphia Starbucks where two black men were arrested last Thursday, however, is located in a zip code that is 79 percent white and just 6 percent black. In all likelihood, most of the clientele there is white, which, to borrow from sociologist Elijah Anderson, makes this particular location a “white space,” or an area whose “most visible and distinctive feature is [the] overwhelming presence of white people and [the] absence of black people.”

This may explain why a Starbucks staff member called the police while the two men were waiting on a business associate. The employee says the men were trespassing and refused to leave the restaurant. Video of the incident—taken by a bystander—shows them standing like any potential customers. That same footage shows their business associate arrive as they are arrested. He is white.

Race is about power and hierarchy. When one is “raced,” one is placed in relationship to that hierarchy—your position assigned to your body and made visible to the world. Places, too, can be raced. Spaces of affluence and exclusivity are typically associated with white faces, reflecting racial distributions of wealth and power. Films like Get Out take that association as a given, a conceit the filmmaker doesn’t even have to explain to the audience. There are “black spaces,” too. In a paper titled “The Iconic Ghetto,” Anderson details the tight association between public housing projects and the black poor, a connection so strong that it’s become part of the overall racial stigma against blacks—a singular black pathology that supposedly explains the material conditions of those projects. Blacks, in this view, come from the ghetto and they carry the ghetto with them, representing its putative danger, crime, and poverty.

Advertisement

Advertisement

Advertisement

Advertisement

To many white Americans, this marks blacks as an inherent threat to the order and safety of their spaces. As Anderson writes, “When the anonymous black person enters the white space, others there immediately try to make sense of him or her—to figure out ‘who that is,’ or to gain a sense of the nature of the person’s business and whether they need to be concerned.”

In these situations, black Americans face heightened scrutiny. This might mean racial profiling, as when shoppers are followed and questioned in retail stores. In 2013, according to the Pew Research Center, 44 percent of black Americans reported such treatment. It might mean unjustified contact with law enforcement. In Pulled Over: How Police Stops Define Race and Citizenship, authors Charles Epp, Steven Maynard-Moody, and Donald Haider-Markel find that suburban and exurban police are much more likely to stop black drivers for intrusive stops; white drivers are rarely stopped for such purposes.

Advertisement

Or it may mean violence. In mid-century Detroit, white mobs attacked and occasionally torched the homes of black people who moved in—or even near—all-white enclaves. In 1986, 23-year-old Michael Griffith died while fleeing a group of white men wielding baseball bats. His offense? Walking through Howard Beach, a largely white neighborhood of Queens, New York. And just last week, 14-year-old Brennan Walker was shot at after knocking on a door in the predominantly white Rochester Hills, Michigan. He was walking to school and had stopped to ask for directions.

Advertisement

Nothing so dire happened for the men of the Philadelphia Starbucks. Philadelphia Police Commissioner Richard Ross, who is also black, says the officers who arrested the two men behaved appropriately. “The police did not just happen upon this event—they did not just walk into Starbucks to get a coffee,” he said in a video posted to Facebook. “They were called there, for a service, and that service had to do with quelling a disturbance, a disturbance that had to do with trespassing. These officers did absolutely nothing wrong.”

Advertisement

Advertisement

The commissioner isn’t wrong about the scope of police authority in this situation. Once called to Starbucks, officers had every right to make an arrest and remove the men from the property. They were released from custody, and company CEO Kevin Johnson issued an apology. The police are conducting an internal investigation of the arrests. What’s critical is that this isn’t an isolated occurrence. Black Americans across class, gender, and other social lines have similar stories of hostile examination, or worse, when they find themselves in a “white space.”

Everyone, eventually, finds themselves out of place. But it’s only some people—raced people—who have to move with particular care through unfamiliar spaces, lest they bring ruinous scrutiny on themselves. And too often, even that caution is not enough."
